{
  "schema_version": "1.0.0",
  "result_id": "60000000-0000-4000-8000-000000000001",
  "task_id": "40000000-0000-4000-8000-000000000001",
  "execution_id": "40000000-0000-4000-8000-000000000002",
  "status": "completed",
  "outcome": "inconclusive",
  "started_at": "2026-07-12T12:00:00Z",
  "finished_at": "2026-07-12T12:00:01Z",
  "provider": {"provider_id": "native-http", "provider_version": "1.0.0", "method": "http_get"},
  "metrics": [{"metric_id": "wifi.signal.rssi", "value": null, "unit": "dBm", "source": {"plane": "telemetry", "producer": "windows", "method": "os_api", "version": "1.0.0"}, "availability": "unavailable", "confidence": "unknown", "reason": {"code": "not_exposed_by_platform"}}],
  "idempotency_key": "60000000-0000-4000-8000-000000000002",
  "reason": null
}
